{
  "month": "2026-02",
  "sections": [
    {
      "paper_ids": [
        "2602.11558"
      ],
      "title": "benchmark"
    },
    {
      "paper_ids": [
        "2602.18478",
        "2602.13857",
        "2602.16951",
        "2602.17251"
      ],
      "title": "new_model"
    },
    {
      "paper_ids": [
        "2602.03269"
      ],
      "title": "survey"
    }
  ],
  "stats": {
    "accepted": 6,
    "candidates": 18,
    "summarized": 6
  },
  "top_picks": [
    "2602.18478",
    "2602.16951",
    "2602.17251",
    "2602.13857",
    "2602.11558"
  ]
}
