{
  "month": "2025-06",
  "sections": [
    {
      "paper_ids": [
        "2506.09110",
        "2507.14141",
        "2506.16056",
        "2506.17068",
        "2506.20354",
        "2506.23075"
      ],
      "title": "new_model"
    },
    {
      "paper_ids": [
        "2506.01867"
      ],
      "title": "other"
    },
    {
      "paper_ids": [
        "2506.06353"
      ],
      "title": "survey"
    }
  ],
  "stats": {
    "accepted": 8,
    "candidates": 20,
    "summarized": 8
  },
  "top_picks": [
    "2507.14141",
    "2506.20354",
    "2506.01867",
    "2506.23075",
    "2506.17068"
  ]
}
